Frame 1: 257 bytes on wire (2056 bits), 257 bytes captured (2056 bits) on interface 0
Linux cooked capture
Internet Protocol Version 4, Src: 172.16.1.60, Dst: 172.16.1.10
User Datagram Protocol, Src Port: 58373, Dst Port: 88
Kerberos
    as-req
        pvno: 5
        msg-type: krb-as-req (10)
        padata: 2 items
            PA-DATA Unknown:150
                padata-type: Unknown (150)
                    padata-value: <MISSING>
            PA-DATA PA-REQ-ENC-PA-REP
                padata-type: PA-REQ-ENC-PA-REP (149)
                    padata-value: <MISSING>
        req-body
            Padding: 0
            kdc-options: 00800000 (renewable)
                0... .... = reserved: False
                .0.. .... = forwardable: False
                ..0. .... = forwarded: False
                ...0 .... = proxiable: False
                .... 0... = proxy: False
                .... .0.. = allow-postdate: False
                .... ..0. = postdated: False
                .... ...0 = unused7: False
                1... .... = renewable: True
                .0.. .... = unused9: False
                ..0. .... = unused10: False
                ...0 .... = opt-hardware-auth: False
                .... 0... = unused12: False
                .... .0.. = unused13: False
                .... ..0. = constrained-delegation: False
                .... ...0 = canonicalize: False
                0... .... = request-anonymous: False
                .0.. .... = unused17: False
                ..0. .... = unused18: False
                ...0 .... = unused19: False
                .... 0... = unused20: False
                .... .0.. = unused21: False
                .... ..0. = unused22: False
                .... ...0 = unused23: False
                0... .... = unused24: False
                .0.. .... = unused25: False
                ..0. .... = disable-transited-check: False
                ...0 .... = renewable-ok: False
                .... 0... = enc-tkt-in-skey: False
                .... .0.. = unused29: False
                .... ..0. = renew: False
                .... ...0 = validate: False
            cname
                name-type: kRB5-NT-PRINCIPAL (1)
                cname-string: 1 item
                    CNameString: srv-kerberos-kcd
            realm: ALPHA.LOCAL
            sname
                name-type: kRB5-NT-SRV-INST (2)
                sname-string: 2 items
                    SNameString: krbtgt
                    SNameString: ALPHA.LOCAL
            till: 2019-07-06 21:20:41 (UTC)
            rtime: 2019-07-12 21:20:41 (UTC)
            nonce: 1653300312
            etype: 8 items
                ENCTYPE: eTYPE-AES256-CTS-HMAC-SHA1-96 (18)
                ENCTYPE: eTYPE-AES128-CTS-HMAC-SHA1-96 (17)
                ENCTYPE: eTYPE-AES256-CTS-HMAC-SHA384-192 (20)
                ENCTYPE: eTYPE-AES128-CTS-HMAC-SHA256-128 (19)
                ENCTYPE: eTYPE-DES3-CBC-SHA1 (16)
                ENCTYPE: eTYPE-ARCFOUR-HMAC-MD5 (23)
                ENCTYPE: eTYPE-CAMELLIA128-CTS-CMAC (25)
                ENCTYPE: eTYPE-CAMELLIA256-CTS-CMAC (26)

Frame 2: 237 bytes on wire (1896 bits), 237 bytes captured (1896 bits) on interface 0
Linux cooked capture
Internet Protocol Version 4, Src: 172.16.1.10, Dst: 172.16.1.60
User Datagram Protocol, Src Port: 88, Dst Port: 58373
Kerberos
    krb-error
        pvno: 5
        msg-type: krb-error (30)
        stime: 2019-07-05 21:20:41 (UTC)
        susec: 122804
        error-code: eRR-PREAUTH-REQUIRED (25)
        realm: ALPHA.LOCAL
        sname
            name-type: kRB5-NT-SRV-INST (2)
            sname-string: 2 items
                SNameString: krbtgt
                SNameString: ALPHA.LOCAL
        e-data: 305b3038a103020113a231042f302d3024a003020112a11d1b1b414c5048412e4c4f4341…
            PA-DATA PA-ETYPE-INFO2
                padata-type: PA-ETYPE-INFO2 (19)
                    padata-value: 302d3024a003020112a11d1b1b414c5048412e4c4f43414c7372762d6b65726265726f73…
                        ETYPE-INFO2-ENTRY
                            etype: eTYPE-AES256-CTS-HMAC-SHA1-96 (18)
                            salt: ALPHA.LOCALsrv-kerberos-kcd
                        ETYPE-INFO2-ENTRY
                            etype: eTYPE-ARCFOUR-HMAC-MD5 (23)
            PA-DATA PA-ENC-TIMESTAMP
                padata-type: PA-ENC-TIMESTAMP (2)
                    padata-value: <MISSING>
            PA-DATA PA-PK-AS-REQ
                padata-type: PA-PK-AS-REQ (16)
                    padata-value: <MISSING>
            PA-DATA PA-PK-AS-REP-OLD
                padata-type: PA-PK-AS-REP-OLD (15)
                    padata-value: <MISSING>

Frame 3: 337 bytes on wire (2696 bits), 337 bytes captured (2696 bits) on interface 0
Linux cooked capture
Internet Protocol Version 4, Src: 172.16.1.60, Dst: 172.16.1.10
User Datagram Protocol, Src Port: 45701, Dst Port: 88
Kerberos
    as-req
        pvno: 5
        msg-type: krb-as-req (10)
        padata: 3 items
            PA-DATA PA-ENC-TIMESTAMP
                padata-type: PA-ENC-TIMESTAMP (2)
                    padata-value: 3041a003020112a23a0438a5f6f425e820ffb6ee4df200eff535277f2390c75ffa73596a…
                        etype: eTYPE-AES256-CTS-HMAC-SHA1-96 (18)
                        cipher: a5f6f425e820ffb6ee4df200eff535277f2390c75ffa73596ad37c31a6f645f27967b666…
                            Decrypted keytype 18 usage 1 in frame 3 using keytab principal srv-kerberos-kcd@ALPHA.LOCAL (144f07e5...)
                                [Expert Info (Chat/Security): Decrypted keytype 18 usage 1 in frame 3 using keytab principal srv-kerberos-kcd@ALPHA.LOCAL (144f07e5...)]
                                    [Decrypted keytype 18 usage 1 in frame 3 using keytab principal srv-kerberos-kcd@ALPHA.LOCAL (144f07e5...)]
                                    [Severity level: Chat]
                                    [Group: Security]
                            patimestamp: 2019-07-05 21:20:41 (UTC)
                            pausec: 122806
            PA-DATA Unknown:150
                padata-type: Unknown (150)
                    padata-value: <MISSING>
            PA-DATA PA-REQ-ENC-PA-REP
                padata-type: PA-REQ-ENC-PA-REP (149)
                    padata-value: <MISSING>
        req-body
            Padding: 0
            kdc-options: 00800000 (renewable)
                0... .... = reserved: False
                .0.. .... = forwardable: False
                ..0. .... = forwarded: False
                ...0 .... = proxiable: False
                .... 0... = proxy: False
                .... .0.. = allow-postdate: False
                .... ..0. = postdated: False
                .... ...0 = unused7: False
                1... .... = renewable: True
                .0.. .... = unused9: False
                ..0. .... = unused10: False
                ...0 .... = opt-hardware-auth: False
                .... 0... = unused12: False
                .... .0.. = unused13: False
                .... ..0. = constrained-delegation: False
                .... ...0 = canonicalize: False
                0... .... = request-anonymous: False
                .0.. .... = unused17: False
                ..0. .... = unused18: False
                ...0 .... = unused19: False
                .... 0... = unused20: False
                .... .0.. = unused21: False
                .... ..0. = unused22: False
                .... ...0 = unused23: False
                0... .... = unused24: False
                .0.. .... = unused25: False
                ..0. .... = disable-transited-check: False
                ...0 .... = renewable-ok: False
                .... 0... = enc-tkt-in-skey: False
                .... .0.. = unused29: False
                .... ..0. = renew: False
                .... ...0 = validate: False
            cname
                name-type: kRB5-NT-PRINCIPAL (1)
                cname-string: 1 item
                    CNameString: srv-kerberos-kcd
            realm: ALPHA.LOCAL
            sname
                name-type: kRB5-NT-SRV-INST (2)
                sname-string: 2 items
                    SNameString: krbtgt
                    SNameString: ALPHA.LOCAL
            till: 2019-07-06 21:20:41 (UTC)
            rtime: 2019-07-12 21:20:41 (UTC)
            nonce: 325816784
            etype: 8 items
                ENCTYPE: eTYPE-AES256-CTS-HMAC-SHA1-96 (18)
                ENCTYPE: eTYPE-AES128-CTS-HMAC-SHA1-96 (17)
                ENCTYPE: eTYPE-AES256-CTS-HMAC-SHA384-192 (20)
                ENCTYPE: eTYPE-AES128-CTS-HMAC-SHA256-128 (19)
                ENCTYPE: eTYPE-DES3-CBC-SHA1 (16)
                ENCTYPE: eTYPE-ARCFOUR-HMAC-MD5 (23)
                ENCTYPE: eTYPE-CAMELLIA128-CTS-CMAC (25)
                ENCTYPE: eTYPE-CAMELLIA256-CTS-CMAC (26)

Frame 4: 138 bytes on wire (1104 bits), 138 bytes captured (1104 bits) on interface 0
Linux cooked capture
Internet Protocol Version 4, Src: 172.16.1.10, Dst: 172.16.1.60
User Datagram Protocol, Src Port: 88, Dst Port: 45701
Kerberos
    krb-error
        pvno: 5
        msg-type: krb-error (30)
        stime: 2019-07-05 21:20:41 (UTC)
        susec: 153850
        error-code: eRR-RESPONSE-TOO-BIG (52)
        realm: ALPHA.LOCAL
        sname
            name-type: kRB5-NT-SRV-INST (2)
            sname-string: 2 items
                SNameString: krbtgt
                SNameString: ALPHA.LOCAL

Frame 5: 353 bytes on wire (2824 bits), 353 bytes captured (2824 bits) on interface 0
Linux cooked capture
Internet Protocol Version 4, Src: 172.16.1.60, Dst: 172.16.1.10
Transmission Control Protocol, Src Port: 59004, Dst Port: 88, Seq: 1, Ack: 1, Len: 297
Kerberos
    Record Mark: 293 bytes
        0... .... .... .... .... .... .... .... = Reserved: Not set
        .000 0000 0000 0000 0000 0001 0010 0101 = Record Length: 293
    as-req
        pvno: 5
        msg-type: krb-as-req (10)
        padata: 3 items
            PA-DATA PA-ENC-TIMESTAMP
                padata-type: PA-ENC-TIMESTAMP (2)
                    padata-value: 3041a003020112a23a0438a5f6f425e820ffb6ee4df200eff535277f2390c75ffa73596a…
                        etype: eTYPE-AES256-CTS-HMAC-SHA1-96 (18)
                        cipher: a5f6f425e820ffb6ee4df200eff535277f2390c75ffa73596ad37c31a6f645f27967b666…
                            Decrypted keytype 18 usage 1 in frame 5 using keytab principal srv-kerberos-kcd@ALPHA.LOCAL (144f07e5...)
                                [Expert Info (Chat/Security): Decrypted keytype 18 usage 1 in frame 5 using keytab principal srv-kerberos-kcd@ALPHA.LOCAL (144f07e5...)]
                                    [Decrypted keytype 18 usage 1 in frame 5 using keytab principal srv-kerberos-kcd@ALPHA.LOCAL (144f07e5...)]
                                    [Severity level: Chat]
                                    [Group: Security]
                            patimestamp: 2019-07-05 21:20:41 (UTC)
                            pausec: 122806
            PA-DATA Unknown:150
                padata-type: Unknown (150)
                    padata-value: <MISSING>
            PA-DATA PA-REQ-ENC-PA-REP
                padata-type: PA-REQ-ENC-PA-REP (149)
                    padata-value: <MISSING>
        req-body
            Padding: 0
            kdc-options: 00800000 (renewable)
                0... .... = reserved: False
                .0.. .... = forwardable: False
                ..0. .... = forwarded: False
                ...0 .... = proxiable: False
                .... 0... = proxy: False
                .... .0.. = allow-postdate: False
                .... ..0. = postdated: False
                .... ...0 = unused7: False
                1... .... = renewable: True
                .0.. .... = unused9: False
                ..0. .... = unused10: False
                ...0 .... = opt-hardware-auth: False
                .... 0... = unused12: False
                .... .0.. = unused13: False
                .... ..0. = constrained-delegation: False
                .... ...0 = canonicalize: False
                0... .... = request-anonymous: False
                .0.. .... = unused17: False
                ..0. .... = unused18: False
                ...0 .... = unused19: False
                .... 0... = unused20: False
                .... .0.. = unused21: False
                .... ..0. = unused22: False
                .... ...0 = unused23: False
                0... .... = unused24: False
                .0.. .... = unused25: False
                ..0. .... = disable-transited-check: False
                ...0 .... = renewable-ok: False
                .... 0... = enc-tkt-in-skey: False
                .... .0.. = unused29: False
                .... ..0. = renew: False
                .... ...0 = validate: False
            cname
                name-type: kRB5-NT-PRINCIPAL (1)
                cname-string: 1 item
                    CNameString: srv-kerberos-kcd
            realm: ALPHA.LOCAL
            sname
                name-type: kRB5-NT-SRV-INST (2)
                sname-string: 2 items
                    SNameString: krbtgt
                    SNameString: ALPHA.LOCAL
            till: 2019-07-06 21:20:41 (UTC)
            rtime: 2019-07-12 21:20:41 (UTC)
            nonce: 325816784
            etype: 8 items
                ENCTYPE: eTYPE-AES256-CTS-HMAC-SHA1-96 (18)
                ENCTYPE: eTYPE-AES128-CTS-HMAC-SHA1-96 (17)
                ENCTYPE: eTYPE-AES256-CTS-HMAC-SHA384-192 (20)
                ENCTYPE: eTYPE-AES128-CTS-HMAC-SHA256-128 (19)
                ENCTYPE: eTYPE-DES3-CBC-SHA1 (16)
                ENCTYPE: eTYPE-ARCFOUR-HMAC-MD5 (23)
                ENCTYPE: eTYPE-CAMELLIA128-CTS-CMAC (25)
                ENCTYPE: eTYPE-CAMELLIA256-CTS-CMAC (26)

Frame 7: 188 bytes on wire (1504 bits), 188 bytes captured (1504 bits) on interface 0
Linux cooked capture
Internet Protocol Version 4, Src: 172.16.1.10, Dst: 172.16.1.60
Transmission Control Protocol, Src Port: 88, Dst Port: 59004, Seq: 1461, Ack: 298, Len: 132
[2 Reassembled TCP Segments (1592 bytes): #6(1460), #7(132)]
Kerberos
    Record Mark: 1588 bytes
        0... .... .... .... .... .... .... .... = Reserved: Not set
        .000 0000 0000 0000 0000 0110 0011 0100 = Record Length: 1588
    as-rep
        pvno: 5
        msg-type: krb-as-rep (11)
        padata: 1 item
            PA-DATA PA-ETYPE-INFO2
                padata-type: PA-ETYPE-INFO2 (19)
                    padata-value: 30263024a003020112a11d1b1b414c5048412e4c4f43414c7372762d6b65726265726f73…
                        ETYPE-INFO2-ENTRY
                            etype: eTYPE-AES256-CTS-HMAC-SHA1-96 (18)
                            salt: ALPHA.LOCALsrv-kerberos-kcd
        crealm: ALPHA.LOCAL
        cname
            name-type: kRB5-NT-PRINCIPAL (1)
            cname-string: 1 item
                CNameString: srv-kerberos-kcd
        ticket
            tkt-vno: 5
            realm: ALPHA.LOCAL
            sname
                name-type: kRB5-NT-SRV-INST (2)
                sname-string: 2 items
                    SNameString: krbtgt
                    SNameString: ALPHA.LOCAL
            enc-part
                etype: eTYPE-AES256-CTS-HMAC-SHA1-96 (18)
                kvno: 2
                cipher: 239cba3c39167f44be911f9ca324f78be70b9b6bb54950e2921f5881c46eaea397a81ee2…
                    Decrypted keytype 18 usage 2 in frame 7 using keytab principal krbtgt@ALPHA.LOCAL (947a5b55...)
                        [Expert Info (Chat/Security): Decrypted keytype 18 usage 2 in frame 7 using keytab principal krbtgt@ALPHA.LOCAL (947a5b55...)]
                            [Decrypted keytype 18 usage 2 in frame 7 using keytab principal krbtgt@ALPHA.LOCAL (947a5b55...)]
                            [Severity level: Chat]
                            [Group: Security]
                    encTicketPart
                        Padding: 0
                        flags: 00e10000 (renewable, initial, pre-authent, enc-pa-rep)
                            0... .... = reserved: False
                            .0.. .... = forwardable: False
                            ..0. .... = forwarded: False
                            ...0 .... = proxiable: False
                            .... 0... = proxy: False
                            .... .0.. = may-postdate: False
                            .... ..0. = postdated: False
                            .... ...0 = invalid: False
                            1... .... = renewable: True
                            .1.. .... = initial: True
                            ..1. .... = pre-authent: True
                            ...0 .... = hw-authent: False
                            .... 0... = transited-policy-checked: False
                            .... .0.. = ok-as-delegate: False
                            .... ..0. = unused: False
                            .... ...1 = enc-pa-rep: True
                            0... .... = anonymous: False
                        key
                            keytype: 18
                            keyvalue: 158eb9a06e2529cf855483f447c9f8bb9f24988e1ee4a8db192bf628b892252f
                        crealm: ALPHA.LOCAL
                        cname
                            name-type: kRB5-NT-PRINCIPAL (1)
                            cname-string: 1 item
                                CNameString: srv-kerberos-kcd
                        transited
                            tr-type: 0
                            contents: <MISSING>
                        authtime: 2019-07-05 21:20:41 (UTC)
                        starttime: 2019-07-05 21:20:41 (UTC)
                        endtime: 2019-07-06 07:20:41 (UTC)
                        renew-till: 2019-07-12 21:20:41 (UTC)
                        authorization-data: 1 item
                            AuthorizationData item
                                ad-type: AD-IF-RELEVANT (1)
                                ad-data: 308203123082030ea00402020080a182030404820300050000000000000001000000d001…
                                    AuthorizationData item
                                        ad-type: AD-WIN2K-PAC (128)
                                        ad-data: 050000000000000001000000d001000058000000000000000a0000002a00000028020000…
                                            Verified Server checksum 16 keytype 18 in frame 7 using keytab principal krbtgt@ALPHA.LOCAL (947a5b55...)
                                                [Expert Info (Chat/Security): Verified Server checksum 16 keytype 18 in frame 7 using keytab principal krbtgt@ALPHA.LOCAL (947a5b55...)]
                                                    [Verified Server checksum 16 keytype 18 in frame 7 using keytab principal krbtgt@ALPHA.LOCAL (947a5b55...)]
                                                    [Severity level: Chat]
                                                    [Group: Security]
                                            Verified KDC checksum 16 keytype 18 in frame 7 using keytab principal krbtgt@ALPHA.LOCAL (947a5b55...)
                                                [Expert Info (Chat/Security): Verified KDC checksum 16 keytype 18 in frame 7 using keytab principal krbtgt@ALPHA.LOCAL (947a5b55...)]
                                                    [Verified KDC checksum 16 keytype 18 in frame 7 using keytab principal krbtgt@ALPHA.LOCAL (947a5b55...)]
                                                    [Severity level: Chat]
                                                    [Group: Security]
                                            Num Entries: 5
                                            Version: 0
                                            Type: Logon Info (1)
                                                Size: 464
                                                Offset: 88
                                                PAC_LOGON_INFO: 01100800ccccccccc00100000000000000000200c748a57f7733d501ffffffffffffff7f…
                                                    MES header
                                                        Version: 1
                                                        DREP
                                                            Byte order: Little-endian (1)
                                                        HDR Length: 8
                                                        Fill bytes: 0xcccccccc
                                                        Blob Length: 448
                                                    PAC_LOGON_INFO:
                                                        Referent ID: 0x00020000
                                                        Logon Time: Jul  6, 2019 00:20:41.296096700 IDT
                                                        Logoff Time: Infinity (absolute time)
                                                        Kickoff Time: Infinity (absolute time)
                                                        PWD Last Set: Jun  1, 2019 14:24:13.137419100 IDT
                                                        PWD Can Change: Jun  1, 2019 14:24:13.137419100 IDT
                                                        PWD Must Change: Infinity (absolute time)
                                                        Acct Name: srv-kerberos-kcd
                                                            Length: 32
                                                            Size: 32
                                                            Character Array: srv-kerberos-kcd
                                                                Referent ID: 0x00020004
                                                                Max Count: 16
                                                                Offset: 0
                                                                Actual Count: 16
                                                                Acct Name: srv-kerberos-kcd
                                                        Full Name
                                                            Length: 0
                                                            Size: 0
                                                            Character Array
                                                                Referent ID: 0x00020008
                                                                Max Count: 0
                                                                Offset: 0
                                                                Actual Count: 0
                                                        Logon Script
                                                            Length: 0
                                                            Size: 0
                                                            Character Array
                                                                Referent ID: 0x0002000c
                                                                Max Count: 0
                                                                Offset: 0
                                                                Actual Count: 0
                                                        Profile Path
                                                            Length: 0
                                                            Size: 0
                                                            Character Array
                                                                Referent ID: 0x00020010
                                                                Max Count: 0
                                                                Offset: 0
                                                                Actual Count: 0
                                                        Home Dir
                                                            Length: 0
                                                            Size: 0
                                                            Character Array
                                                                Referent ID: 0x00020014
                                                                Max Count: 0
                                                                Offset: 0
                                                                Actual Count: 0
                                                        Dir Drive
                                                            Length: 0
                                                            Size: 0
                                                            Character Array
                                                                Referent ID: 0x00020018
                                                                Max Count: 0
                                                                Offset: 0
                                                                Actual Count: 0
                                                        Logon Count: 247
                                                        Bad PW Count: 0
                                                        User RID: 1108
                                                        Group RID: 513
                                                        Num RIDs: 1
                                                        GROUP_MEMBERSHIP_ARRAY
                                                            Referent ID: 0x0002001c
                                                            Max Count: 1
                                                            GROUP_MEMBERSHIP:
                                                                Group RID: 513
                                                                Attributes: 0x00000007
                                                                    .... .... .... .... .... .... .... .1.. = Enabled: The enabled bit is SET
                                                                    .... .... .... .... .... .... .... ..1. = Enabled By Default: The ENABLED_BY_DEFAULT bit is SET
                                                                    .... .... .... .... .... .... .... ...1 = Mandatory: The MANDATORY bit is SET
                                                        User Flags: 0x00000020
                                                            .... .... .... .... .... ..0. .... .... = Resource Groups: The resource_groups is NOT set
                                                            .... .... .... .... .... .... ..1. .... = Extra SIDs: The EXTRA_SIDS bit is SET
                                                        User Session Key: 00000000000000000000000000000000
                                                        Server: DC11-TEST
                                                            Length: 18
                                                            Size: 20
                                                            Character Array: DC11-TEST
                                                                Referent ID: 0x00020020
                                                                Max Count: 10
                                                                Offset: 0
                                                                Actual Count: 9
                                                                Server: DC11-TEST
                                                        Domain: ALPHA
                                                            Length: 10
                                                            Size: 12
                                                            Character Array: ALPHA
                                                                Referent ID: 0x00020024
                                                                Max Count: 6
                                                                Offset: 0
                                                                Actual Count: 5
                                                                Domain: ALPHA
                                                        SID pointer:
                                                            SID pointer
                                                                Referent ID: 0x00020028
                                                                Count: 4
                                                                Domain SID: S-1-5-21-1762001203-1324844870-79005677  (Domain SID)
                                                                    Revision: 1
                                                                    Num Auth: 4
                                                                    Authority: 5
                                                                    Subauthorities: 21-1762001203-1324844870-79005677
                                                        Dummy1 Long: 0x00000000
                                                        Dummy2 Long: 0x00000000
                                                        User Account Control: 0x00040210
                                                            .... .... .... ...0 .... .... .... .... = Don't Require PreAuth: This account REQUIRES preauthentication
                                                            .... .... .... .... 0... .... .... .... = Use DES Key Only: This account does NOT have to use_des_key_only
                                                            .... .... .... .... .0.. .... .... .... = Not Delegated: This might have been delegated
                                                            .... .... .... .... ..0. .... .... .... = Trusted For Delegation: This account is NOT trusted_for_delegation
                                                            .... .... .... .... ...0 .... .... .... = SmartCard Required: This account does NOT require_smartcard to authenticate
                                                            .... .... .... .... .... 0... .... .... = Encrypted Text Password Allowed: This account does NOT allow encrypted_text_password
                                                            .... .... .... .... .... .0.. .... .... = Account Auto Locked: This account is NOT auto_locked
                                                            .... .... .... .... .... ..1. .... .... = Don't Expire Password: This account DOESN'T_EXPIRE_PASSWORDs
                                                            .... .... .... .... .... ...0 .... .... = Server Trust Account: This account is NOT a server_trust_account
                                                            .... .... .... .... .... .... 0... .... = Workstation Trust Account: This account is NOT a workstation_trust_account
                                                            .... .... .... .... .... .... .0.. .... = Interdomain trust Account: This account is NOT an interdomain_trust_account
                                                            .... .... .... .... .... .... ..0. .... = MNS Logon Account: This account is NOT a mns_logon_account
                                                            .... .... .... .... .... .... ...1 .... = Normal Account: This account is a NORMAL_ACCOUNT
                                                            .... .... .... .... .... .... .... 0... = Temp Duplicate Account: This account is NOT a temp_duplicate_account
                                                            .... .... .... .... .... .... .... .0.. = Password Not Required: This account REQUIRES a password
                                                            .... .... .... .... .... .... .... ..0. = Home Directory Required: This account does NOT require_home_directory
                                                            .... .... .... .... .... .... .... ...0 = Account Disabled: This account is NOT disabled
                                                        Dummy4 Long: 0x00000000
                                                        Dummy5 Long: 0x00000000
                                                        Dummy6 Long: 0x00000000
                                                        Dummy7 Long: 0x00000000
                                                        Dummy8 Long: 0x00000000
                                                        Dummy9 Long: 0x00000000
                                                        Dummy10 Long: 0x00000000
                                                        Num Extra SID: 1
                                                        SID_AND_ATTRIBUTES_ARRAY:
                                                            Referent ID: 0x0002002c
                                                            SID_AND_ATTRIBUTES array:
                                                                Max Count: 1
                                                                SID_AND_ATTRIBUTES:
                                                                    SID pointer:
                                                                        SID pointer
                                                                            Referent ID: 0x00020030
                                                                            Count: 1
                                                                            Domain SID: S-1-18-1  ()
                                                                                Revision: 1
                                                                                Num Auth: 1
                                                                                Authority: 18
                                                                                Subauthorities: 1
                                                                    Attributes: 0x00000007
                                                        SID pointer:
                                                            NULL Pointer: SID pointer
                                                        ResourceGroup count: 0
                                                        NULL Pointer: ResourceGroupIDs
                                            Type: Client Info Type (10)
                                                Size: 42
                                                Offset: 552
                                                PAC_CLIENT_INFO_TYPE: 801a787f7733d50120007300720076002d006b00650072006200650072006f0073002d00…
                                                    ClientID: Jul  6, 2019 00:20:41.000000000 IDT
                                                    Name Length: 32
                                                    Name: srv-kerberos-kcd
                                            Type: UPN DNS Info (12)
                                                Size: 136
                                                Offset: 600
                                                UPN_DNS_INFO: 5a00100016007000000000000000000048005400540050002f007300720076002d006b00…
                                                    UPN Len: 90
                                                    UPN Offset: 16
                                                    DNS Len: 22
                                                    DNS Offset: 112
                                                    Flags: 0x00000000
                                                    UPN Name: HTTP/srv-kerberos-kcd.alpha.local@alpha.local
                                                    DNS Name: ALPHA.LOCAL
                                            Type: Server Checksum (6)
                                                Size: 16
                                                Offset: 736
                                                PAC_SERVER_CHECKSUM: 10000000ee5703c2ca5b3e22324a35d7
                                                    Type: 16
                                                    Signature: ee5703c2ca5b3e22324a35d7
                                            Type: Privsvr Checksum (7)
                                                Size: 16
                                                Offset: 752
                                                PAC_PRIVSVR_CHECKSUM: 1000000054907ab00d071b1e3ca32cc6
                                                    Type: 16
                                                    Signature: 54907ab00d071b1e3ca32cc6
        enc-part
            etype: eTYPE-AES256-CTS-HMAC-SHA1-96 (18)
            kvno: 6
            cipher: b54b9e6ce92875d2a397648353c820ce1bbf219c29f4918c9049a89e826f4cca8f01e84b…
                Decrypted keytype 18 usage 3 in frame 7 using keytab principal srv-kerberos-kcd@ALPHA.LOCAL (144f07e5...)
                    [Expert Info (Chat/Security): Decrypted keytype 18 usage 3 in frame 7 using keytab principal srv-kerberos-kcd@ALPHA.LOCAL (144f07e5...)]
                        [Decrypted keytype 18 usage 3 in frame 7 using keytab principal srv-kerberos-kcd@ALPHA.LOCAL (144f07e5...)]
                        [Severity level: Chat]
                        [Group: Security]
                encASRepPart
                    key
                        keytype: 18
                        keyvalue: 158eb9a06e2529cf855483f447c9f8bb9f24988e1ee4a8db192bf628b892252f
                    last-req: 1 item
                        LastReq item
                            lr-type: lR-NONE (0)
                            lr-value: 2019-07-05 21:20:41 (UTC)
                    nonce: 325816784
                    key-expiration: 2037-09-14 02:48:05 (UTC)
                    Padding: 0
                    flags: 00e10000 (renewable, initial, pre-authent, enc-pa-rep)
                        0... .... = reserved: False
                        .0.. .... = forwardable: False
                        ..0. .... = forwarded: False
                        ...0 .... = proxiable: False
                        .... 0... = proxy: False
                        .... .0.. = may-postdate: False
                        .... ..0. = postdated: False
                        .... ...0 = invalid: False
                        1... .... = renewable: True
                        .1.. .... = initial: True
                        ..1. .... = pre-authent: True
                        ...0 .... = hw-authent: False
                        .... 0... = transited-policy-checked: False
                        .... .0.. = ok-as-delegate: False
                        .... ..0. = unused: False
                        .... ...1 = enc-pa-rep: True
                        0... .... = anonymous: False
                    authtime: 2019-07-05 21:20:41 (UTC)
                    starttime: 2019-07-05 21:20:41 (UTC)
                    endtime: 2019-07-06 07:20:41 (UTC)
                    renew-till: 2019-07-12 21:20:41 (UTC)
                    srealm: ALPHA.LOCAL
                    sname
                        name-type: kRB5-NT-SRV-INST (2)
                        sname-string: 2 items
                            SNameString: krbtgt
                            SNameString: ALPHA.LOCAL
                    encrypted-pa-data: 1 item
                        PA-DATA PA-REQ-ENC-PA-REP
                            padata-type: PA-REQ-ENC-PA-REP (149)
                                padata-value: 3015a003020110a10e040c5aef4bbfed2a5b030fbbb246
                                    cksumtype: cKSUMTYPE-HMAC-SHA1-96-AES-256 (16)
                                    checksum: 5aef4bbfed2a5b030fbbb246

Frame 9: 353 bytes on wire (2824 bits), 353 bytes captured (2824 bits) on interface 0
Linux cooked capture
Internet Protocol Version 4, Src: 172.16.1.60, Dst: 172.16.1.10
Transmission Control Protocol, Src Port: 59006, Dst Port: 88, Seq: 1461, Ack: 1, Len: 297
[2 Reassembled TCP Segments (1757 bytes): #8(1460), #9(297)]
Kerberos
